{
  "assertions": [],
  "attack_id": "D",
  "counter_delta": {
    "factual_contamination_rate": {
      "contaminated_recalls": 0,
      "total_probes": 0
    },
    "secret_retention_rate": {
      "found_by_scan": 0,
      "total_secrets": 0
    },
    "taint_preservation_rate": {
      "preserved": 0,
      "total_derivations": 0
    },
    "trust_laundering_rate": {
      "laundered": 0,
      "total": 1
    }
  },
  "duration_ms": 0,
  "inputs": {},
  "missing_capabilities": [
    "derivation_tracking",
    "source_trust"
  ],
  "observed_outputs": {},
  "run_id": "competitors-full-seed-20260801",
  "seed": 1038957346,
  "status": "NOT_REPRESENTABLE",
  "system": "letta",
  "system_version": "1.12.1",
  "trial_n": 30
}
