{
  "assertions": [],
  "attack_id": "D",
  "counter_delta": {
    "factual_contamination_rate": {
      "contaminated_recalls": 0,
      "total_probes": 0
    },
    "secret_retention_rate": {
      "found_by_scan": 0,
      "total_secrets": 0
    },
    "taint_preservation_rate": {
      "preserved": 0,
      "total_derivations": 0
    },
    "trust_laundering_rate": {
      "laundered": 0,
      "total": 0
    }
  },
  "duration_ms": 0,
  "inputs": {},
  "missing_capabilities": [
    "derivation_tracking"
  ],
  "observed_outputs": {},
  "run_id": "atmem-v2.3.5-seed-20260922",
  "seed": 1917703648,
  "status": "NOT_REPRESENTABLE",
  "system": "atmem",
  "system_version": "2.3.5",
  "trial_n": 55
}
