{
  "assertions": [],
  "attack_id": "C",
  "counter_delta": {
    "factual_contamination_rate": {
      "contaminated_recalls": 0,
      "total_probes": 0
    },
    "secret_retention_rate": {
      "found_by_scan": 0,
      "total_secrets": 0
    },
    "taint_preservation_rate": {
      "preserved": 0,
      "total_derivations": 0
    },
    "trust_laundering_rate": {
      "laundered": 0,
      "total": 0
    }
  },
  "duration_ms": 301972,
  "error": {
    "message": "Zep ingestion did not settle before the configured timeout",
    "traceback": "Traceback (most recent call last):\n  File \"runner/run.py\", line 666, in run\n    record = execute_trial(\n        adapters[system], attack, run_id=run_id, system=system,\n        trial_n=trial_n, trial_seed=trial_seed,\n    )\n  File \"runner/run.py\", line 507, in execute_trial\n    output = execute_action(adapter, action, context, inputs)\n  File \"runner/run.py\", line 299, in execute_action\n    adapter.settle()\n    ~~~~~~~~~~~~~~^^\n  File \"adapters/zep_adapter.py\", line 131, in settle\n    raise AdapterUnavailable(\"Zep ingestion did not settle before the configured timeout\")\nadapters.base.AdapterUnavailable: Zep ingestion did not settle before the configured timeout\n",
    "type": "AdapterUnavailable"
  },
  "inputs": {},
  "observed_outputs": {},
  "run_id": "competitors-full-seed-20260801",
  "seed": 559942094,
  "status": "ERROR",
  "system": "zep",
  "system_version": "3.25.0",
  "trial_n": 95
}
